citation_journal,link,PMID
"Dingeman RS, Barus LM, Chung HK, Clendenin DJ, Lee CS, Tracy S, et al. Ultrasonography‐guided bilateral rectus sheath block vs local anesthetic infiltration after pediatric umbilical hernia repair: a prospective randomized clinical trial.  JAMA Surgery 2013;148(8):707‐13. [PUBMED: 23760519] CENTRAL   PubMed     Google Scholar",https://www.ncbi.nlm.nih.gov/pubmed/23760519,23760519
"Nan Y, Zhou J, Ma Q, Li T, Lian QQ, Li J. Application of ultrasound guidance for ilioinguinal or iliohypogastric nerve block in paediatric inguinal surgery.  Zhonghua Yi Xue Za Zhi 2012;92(13):873‐7. [PUBMED: 22781525] CENTRAL   PubMed     Google Scholar",https://www.ncbi.nlm.nih.gov/pubmed/22781525,22781525
"Marhofer P, Sitzwohl C, Greher M, Kapral S. Ultrasound guidance for infraclavicular brachial plexus anaesthesia in children.  Anaesthesia 2004;59(7):642‐6. [DOI: 10.1111/j.1365‐2044.2004.03669.x; PUBMED: 15200537] CENTRAL   PubMed     Google Scholar",https://www.ncbi.nlm.nih.gov/pubmed/15200537,15200537
"O'Sullivan MJ, Mislovic B, Alexander E. Dorsal penile nerve block for male paediatric circumcision ‐ randomized comparison of ultrasound‐guided vs anatomical landmark technique.  Paediatric Anaesthesia 2011;21(12):1214‐8. [DOI: 10.1111/j.1460‐9592.2011.03722.x; PUBMED: 22023417] CENTRAL   PubMed     Google Scholar",https://www.ncbi.nlm.nih.gov/pubmed/22023417,22023417
"Teunkens A, Velde M, Vermeulen K, Loon P, Bogaert G, Fieuws S, et al. Dorsal penile nerve block for circumcision in pediatric patients: a prospective, observer‐blinded, randomized controlled clinical trial for the comparison of ultrasound‐guided vs landmark technique.  Pediatric Anesthesia 2018;28(8):703‐9. [DOI: 10.1111/pan.13429; PUBMED: 30035357] CENTRAL   PubMed     Google Scholar",https://www.ncbi.nlm.nih.gov/pubmed/30035357,30035357
"Liu W, Liu J, Tan X, Wang S. Ultrasound‐guided lower forearm median nerve block in open surgery for trigger thumb in 1‐ to 3‐year‐old children: a randomized trial.  Paediatric Anaesthesia 2018;28(2):134‐41. [DOI: 10.1111/pan.13296; PUBMED: 29205686] CENTRAL   PubMed     Google Scholar",https://www.ncbi.nlm.nih.gov/pubmed/29205686,29205686
"Weintraud M, Lundblad M, Kettner SC, Willschke H, Kapral S, Lonnqvist PA, et al. Ultrasound versus landmark‐based technique for ilioinguinal‐iliohypogastric nerve blockade in children: the implications on plasma levels of ropivacaine.  Anesthesia and Analgesia 2009;108(5):1488‐92. [DOI: 10.1213/ane.0b013e31819cb1f3; PUBMED: 19372326] CENTRAL   PubMed     Google Scholar",https://www.ncbi.nlm.nih.gov/pubmed/19372326,19372326
"Liu JZ, Wu XQ, Li R, Zhang YJ. A comparison of ultrasonography versus traditional approach for caudal block in children.  Zhonghua Yi Xue Za Zhi 2012;92(13):882‐5. [PUBMED: 22781527] CENTRAL   PubMed     Google Scholar",https://www.ncbi.nlm.nih.gov/pubmed/22781527,22781527
"Litz CN, Farach SM, Fernandez AM, Elliott R, Dolan J, Patel N, et al. Percutaneous ultrasound‐guided vs. intraoperative rectus sheath block for pediatric umbilical hernia repair: a randomized clinical trial.  Journal of Pediatric Surgery 2017;52(6):901‐6. [DOI: 10.1016/j.jpedsurg.2017.03.007; PUBMED: 28377023] CENTRAL   PubMed     Google Scholar",https://www.ncbi.nlm.nih.gov/pubmed/28377023,28377023
"Willschke H, Marhofer P, Bosenberg A, Johnston S, Wanzel O, Cox SG, et al. Ultrasonography for ilioinguinal/iliohypogastric nerve blocks in children.  British Journal of Anaesthesia 2005;95(2):226‐30. [DOI: 10.1093/bja/aei157; PUBMED: 15923270] CENTRAL   PubMed     Google Scholar",https://www.ncbi.nlm.nih.gov/pubmed/15923270,15923270
"Kendigelen P, Tutuncu AC, Erbabacan E, Ekici B, Koksal G, Altindas F, et al. Ultrasound‐assisted transversus abdominis plane block vs wound infiltration in pediatric patient with inguinal hernia: randomized controlled trial.  Journal of Clinical Anesthesia 2016;30:9‐14. [DOI: 10.1016/j.jclinane.2015.12.027; PUBMED: 27041256] CENTRAL   PubMed     Google Scholar",https://www.ncbi.nlm.nih.gov/pubmed/27041256,27041256
"Wang LZ, Hu XX, Zhang YF, Chang XY. A randomized comparison of caudal block by sacral hiatus injection under ultrasound guidance with traditional sacral canal injection in children.  Paediatric Anaesthesia 2013;23(5):395‐400. [PUBMED: 23278906] CENTRAL   PubMed     Google Scholar",https://www.ncbi.nlm.nih.gov/pubmed/23278906,23278906
"Faraoni D, Gilbeau A, Lingier P, Barvais L, Engelman E, Hennart D. Does ultrasound guidance improve the efficacy of dorsal penile nerve block in children?.  Paediatric Anaesthesia 2010;20(10):931‐6. [PUBMED: 20849498] CENTRAL   PubMed     Google Scholar",https://www.ncbi.nlm.nih.gov/pubmed/20849498,20849498
"Flack SH, Martin LD, Walker BJ, Bosenberg AT, Helmers LD, Goldin AB, et al. Ultrasound‐guided rectus sheath block or wound infiltration in children: a randomized blinded study of analgesia and bupivacaine absorption.  Paediatric Anaesthesia 2014;24(9):968‐73. [DOI: 10.1111/pan.12438; PUBMED: 24853314] CENTRAL   PubMed     Google Scholar",https://www.ncbi.nlm.nih.gov/pubmed/24853314,24853314
"Oberndorfer U, Marhofer P, Bosenberg A, Willschke H, Felfernig M, Weintraud M, et al. Ultrasonographic guidance for sciatic and femoral nerve blocks in children.  British Journal of Anaesthesia 2007;98(6):797‐801. [DOI: 10.1093/bja/aem092; PUBMED: 17449890] CENTRAL   PubMed     Google Scholar",https://www.ncbi.nlm.nih.gov/pubmed/17449890,17449890
"Sahin L, Sahin M, Gul R, Saricicek V, Isikay N. Ultrasound‐guided transversus abdominis plane block in children: a randomised comparison with wound infiltration.  European Journal of Anaesthesiology 2013;30(7):409‐14. [DOI: 10.1097/EJA.0b013e32835d2fcb; PUBMED: 23338056] CENTRAL   PubMed     Google Scholar",https://www.ncbi.nlm.nih.gov/pubmed/23338056,23338056
"Willschke H, Marhofer P, Bosenberg A, Johnston S, Wanzel O, Sitzwohl C, et al. Epidural catheter placement in children: comparing a novel approach using ultrasound guidance and a standard loss‐of‐resistance technique.  British Journal of Anaesthesia 2006;97(2):200‐7. [DOI: 10.1093/bja/ael121; PUBMED: 16720672] CENTRAL   PubMed     Google Scholar",https://www.ncbi.nlm.nih.gov/pubmed/16720672,16720672
"Gurnaney HG, Maxwell LG, Kraemer FW, Goebel T, Nance ML, Ganesh A. Prospective randomized observer‐blinded study comparing the analgesic efficacy of ultrasound‐guided rectus sheath block and local anaesthetic infiltration for umbilical hernia repair.  British Journal of Anaesthesia 2011;107(5):790‐5. [PUBMED: 21856778] CENTRAL   PubMed     Google Scholar",https://www.ncbi.nlm.nih.gov/pubmed/21856778,21856778
"Relland LM, Tobias JD, Martin D, Veneziano G, Beltran RJ, McKee C, et al. Ultrasound‐guided rectus sheath block, caudal analgesia, or surgical site infiltration for pediatric umbilical herniorrhaphy: a prospective, double‐blinded, randomized comparison of three regional anesthetic techniques.  Journal of Pain Research 2017;10:2629‐34. [DOI: 10.2147/JPR.S144259; PUBMED: 29184439] CENTRAL   PubMed     Google Scholar",https://www.ncbi.nlm.nih.gov/pubmed/29184439,29184439
"Lorenzo AJ, Lynch J, Matava C, El‐Beheiry H, Hayes J. Ultrasound guided transversus abdominis plane vs surgeon administered intraoperative regional field infiltration with bupivacaine for early postoperative pain control in children undergoing open pyeloplasty.  Journal of Urology 2014;192(1):207‐13. [PUBMED: 24518763] CENTRAL   PubMed     Google Scholar",https://www.ncbi.nlm.nih.gov/pubmed/24518763,24518763
"Ahiskalioglu A, Yayik AM, Ahiskalioglu EO, Ekinci M, Golboyu BE, Celik EC, et al. Ultrasound‐guided versus conventional injection for caudal block in children: a prospective randomized clinical study.  Journal of Clinical Anesthesia 2018;44:91‐6. [DOI: 10.1016/j.jclinane.2017.11.011; PUBMED: 29161549] CENTRAL   PubMed     Google Scholar",https://www.ncbi.nlm.nih.gov/pubmed/29161549,29161549
"Ponde VC, Diwan S. Does ultrasound guidance improve the success rate of infraclavicular brachial plexus block when compared with nerve stimulation in children with radial club hands?.  Anesthesia and Analgesia 2009;108(6):1967‐70. [DOI: 10.1213/ane.0b013e3181a2a252; PUBMED: 19448233] CENTRAL   PubMed     Google Scholar",https://www.ncbi.nlm.nih.gov/pubmed/19448233,19448233
"Uchinami Y, Sakuraya F, Tanaka N, Hoshino K, Mikami E, Ishikawa T, et al. Comparison of the analgesic efficacy of ultrasound‐guided rectus sheath block and local anesthetic infiltration for laparoscopic percutaneous extraperitoneal closure in children.  Paediatric Anaesthesia 2017;27(5):516‐23. [DOI: 10.1111/pan.13085; PUBMED: 28198572] CENTRAL   PubMed     Google Scholar",https://www.ncbi.nlm.nih.gov/pubmed/28198572,28198572
"Yang L, Xu Y, Wang Z, Zhang W. Application of ultrasound‐guided ilioinguinal/iliohypogastric nerve block in pediatric same‐day surgery.  Indian Journal of Surgery 2015;77(6):512‐6. [DOI: 10.1007/s12262‐015‐1301‐0; PUBMED: 26884660] CENTRAL   PubMed     Google Scholar",https://www.ncbi.nlm.nih.gov/pubmed/26884660,26884660
"Ponde V, Desai AP, Shah D. Comparison of success rate of ultrasound‐guided sciatic and femoral nerve block and neurostimulation in children with arthrogryposis multiplex congenita: a randomized clinical trial.  Paediatric Anaesthesia 2013;23(1):74‐8. [DOI: 10.1111/pan.12022; PUBMED: 23004225] CENTRAL   PubMed     Google Scholar",https://www.ncbi.nlm.nih.gov/pubmed/23004225,23004225
"Abasbassi H, Teunkens A, Velde M. Dorsile penile nerve block for circumcision: a comparison of ultrasound‐guided vs. landmark technique.  Regional Anesthesia and Pain Medicine 2017;42(5 Suppl 1):e195. [PUBMED: 22023417] CENTRAL   Google Scholar",https://www.ncbi.nlm.nih.gov/pubmed/22023417,22023417
"Shank ES, Martyn JA, Donelan MB, Perrone A, Firth PG, Driscoll DN. Ultrasound‐guided regional anesthesia for pediatric burn reconstructive surgery: a prospective study.  Journal of Burn Care and Research: Official Publication of the American Burn Association 2016;37(3):e213‐7. [DOI: 10.1097/BCR.0000000000000174; PUBMED: 25412051] CENTRAL   Google Scholar",https://www.ncbi.nlm.nih.gov/pubmed/25412051,25412051
"Tachibana N, Yamauchi M, Sugino S, Watanabe A, Yamakage M. Utility of longitudinal paramedian view of ultrasound imaging for middle thoracic epidural anaesthesia in children.  Journal of Anaesthesia 2012;26(2):242‐5. [DOI: 10.1007/s00540‐011‐1279‐0; PUBMED: 22081114] CENTRAL   Google Scholar",https://www.ncbi.nlm.nih.gov/pubmed/22081114,22081114
