citation_journal,link,PMID
"Coulibaly JT, Knopp S, N'Guessan NA, Silue KD, Furst T, Lohourignon LK, et al. [Accuracy of urine circulating cathodic antigen (CCA) test for Schistosoma mansoni diagnosis in different settings of Cote d'Ivoire].  PLoS Neglected Tropical Diseases 2011;5(11):e1384.    PubMed",https://www.ncbi.nlm.nih.gov/pubmed/22132246,22132246
"Al‐Sherbiny MM, Osman AM, Hancock K, Deelder AM, Tsang VC. [Application of immunodiagnostic assays: detection of antibodies and circulating antigens in human schistosomiasis and correlation with clinical findings].  American Journal of Tropical Medicine and Hygiene 1999;60(6):960‐6.    PubMed",https://www.ncbi.nlm.nih.gov/pubmed/10403328,10403328
"De CD, Sacko M, Vercruysse J, Diarra A, Landoure A, vanden BV, et al. [Comparison of the circulating anodic antigen detection assay and urine filtration to diagnose Schistosoma haematobium infections in Mali].  Transactions of the Royal Society of Tropical Medicine and Hygiene 1995;89(4):395‐7.    PubMed",https://www.ncbi.nlm.nih.gov/pubmed/7570876,7570876
"Cooppan RM, Schutte CH, Dingle CE, Deventer JM, Becker PJ. [Urinalysis reagent strips in the screening of children for urinary schistosomiasis in the RSA].  South African Medical Journal Suid‐Afrikaanse Tydskrif Vir Geneeskunde 1987;72(7):459‐62.    PubMed",https://www.ncbi.nlm.nih.gov/pubmed/3116682,3116682
"Lieshout L, Polman K, Gryseels B, Deelder AM. [Circulating anodic antigen levels in two areas endemic for schistosomiasis mansoni indicate differences in worm fecundity].  Transactions of the Royal Society of Tropical Medicine and Hygiene 1998;92(1):115‐9.    PubMed",https://www.ncbi.nlm.nih.gov/pubmed/9692172,9692172
"Hall A, Fentiman A. [Blood in the urine of adolescent girls in an area of Ghana with a low prevalence of infection with Schistosoma haematobium].  Transactions of the Royal Society of Tropical Medicine and Hygiene 1999;93(4):411‐2.    PubMed",https://www.ncbi.nlm.nih.gov/pubmed/10674091,10674091
"Pugh RNH, Bell DR, Gilles HM. [The potential medical importance of bilharzia in northern Nigeria: a suggested rapid, cheap and effective solution for control of Schistosoma haematobium infection].  Annals of Tropical Medicine and Parasitology 1980;74(6):597‐613.    PubMed",https://www.ncbi.nlm.nih.gov/pubmed/7458464,7458464
"Birrie H, Medhin G, Jemaneh L. [Comparison of urine filtration and a chemical reagent strip in the diagnosis of urinary schistosomiasis in Ethiopia].  East African Medical Journal 1995;72(3):180‐5.    PubMed",https://www.ncbi.nlm.nih.gov/pubmed/7796771,7796771
"Mott KE, Dixon H, Osei‐Tutu E, England EC, Ekue K, Tekle A. [Indirect screening for Schistosoma haematobium infection: a comparative study in Ghana and Zambia].  Bulletin of the World Health Organization 1985;63(1):135‐42.    PubMed",https://www.ncbi.nlm.nih.gov/pubmed/3872732,3872732
"Mott KE, Dixon H, Osei‐Tutu E, England EC, Ekue K, Tekle A. [Indirect screening for Schistosoma haematobium infection: a comparative study in Ghana and Zambia].  Bulletin of the World Health Organization 1985;63(1):135‐42.    PubMed",https://www.ncbi.nlm.nih.gov/pubmed/3872732,3872732
"Ugbomoiko US, Obiezue RNN, Ogunniyi TAB, Ofoezie IE. [Diagnostic accuracy of different urine dipsticks to detect urinary schistosomiasis: a comparative study in five endemic communities in Osun and Ogun States, Nigeria].  Journal of Helminthology 2009;83(3):203‐9.    PubMed",https://www.ncbi.nlm.nih.gov/pubmed/19068147,19068147
"Adriko M, Standley CJ, Tinkitina EM, Fenwick A, Fleming FM, Sousa‐Figueiredo JC, et al. [Evaluation of circulating cathodic antigen (CCA) urine‐cassette assay as a survey tool for Schistosoma mansoni in different transmission settings within Bugiri District, Uganda].  Acta Tropica 2014;136:50‐7.    PubMed",https://www.ncbi.nlm.nih.gov/pubmed/24727052,24727052
"King CH, Keating CE, Muruka JF, Ouma JH, Houser H, Arap Siongok TK, et al. [Urinary tract morbidity in schistosomiasis haematobia: associations with age and intensity of infection in an endemic area of Coast Province, Kenya].  American Journal of Tropical Medicine and Hygiene 1988;39(4):361‐8.    PubMed",https://www.ncbi.nlm.nih.gov/pubmed/3142286,3142286
"Rollinson D, Klinger EV, Mgeni AF, Khamis IS, Stothard JR. [Urinary schistosomiasis on Zanzibar: application of two novel assays for the detection of excreted albumin and haemoglobin in urine].  Journal of Helminthology 2005;79(3):199‐206.    PubMed",https://www.ncbi.nlm.nih.gov/pubmed/16153313,16153313
"Eltoum IA, Sulaiman S, Ismail BM, Ali MM, Elfatih M, Homeida MM. [Evaluation of haematuria as an indirect screening test for schistosomiasis haematobium: a population‐based study in the White Nile province, Sudan].  Acta Tropica 1992;51(2):151‐7.    PubMed",https://www.ncbi.nlm.nih.gov/pubmed/1354933,1354933
"Rasendramino MH, Rajaona HR, Ramarokoto CE, Ravaoalimalala VE, Leutscher P, Cordonnier D, et al. [Prevalence of uro‐nephrologic complications of urinary bilharziasis in hyperendemic focus in Madagascar].  Nephrologie 1998;19(6).",https://www.ncbi.nlm.nih.gov/pubmed/9836196,9836196
"Murare HM, Taylor P. [Haematuria and proteinuria during Schistosoma haematobium infection: relationship to intensity of infection and the value of chemical reagent strips for pre‐ and post‐treatment diagnosis].  Transactions of the Royal Society of Tropical Medicine and Hygiene 1997;81(3):426‐30.",https://www.ncbi.nlm.nih.gov/pubmed/3120368,3120368
"Standley CJ, Lwambo NJS, Lange CN, Kariuki HC, Adriko M, Stothard JR. [Performance of circulating cathodic antigen (CCA) urine‐dipsticks for rapid detection of intestinal schistosomiasis in schoolchildren from shoreline communities of Lake Victoria].  Parasites and Vectors 2010;3(1).",https://www.ncbi.nlm.nih.gov/pubmed/20181101,20181101
"Navaratnam AM, Mutumba‐Nakalembe MJ, Stothard JR, Kabatereine NB, Fenwick A, Sousa‐Figueiredo JC. [Notes on the use of urine‐CCA dipsticks for detection of intestinal schistosomiasis in preschool children.].  Transactions of the Royal Society of Tropical Medicine & Hygiene 2012;106(10):619‐22.",https://www.ncbi.nlm.nih.gov/pubmed/22858241,22858241
